{"schema_version":1,"data_kind":"SYNTHETIC","seed":20261029,"source":"SYNTHETIC existing research.baccarat burn/deal; fully observed point counts","warning":"合成資料僅用於管線驗證，不得用於宣稱真實增量","chronological_order":"oldest_to_newest","rows":[{"data_kind":"SYNTHETIC","shoe_id":"SYNTHETIC-00014","shoe_start":"2026-01-01T14:00:00+00:00","round_index":1,"outcome":"B","initial_counts_after_burn":[128,31,32,30,32,32,32,32,31,32],"remaining_counts_before":[128,31,32,30,32,32,32,32,31,32],"consumed_counts":[2,1,0,1,0,0,1,0,0,1],"composition_source":"synthetic_fully_observed_prefix","composition_through_round":0,"composition_evidence":"SYNTHETIC:seed=20261029:shoe=14:round=1","card_count":6,"player_score":3,"banker_score":6},{"data_kind":"SYNTHETIC","shoe_id":"SYNTHETIC-00014","shoe_start":"2026-01-01T14:00:00+00:00","round_index":2,"outcome":"B","initial_counts_after_burn":[128,31,32,30,32,32,32,32,31,32],"remaining_counts_before":[126,30,32,29,32,32,31,32,31,31],"consumed_counts":[0,0,1,0,2,1,0,0,0,0],"composition_source":"synthetic_fully_observed_prefix","composition_through_round":1,"composition_evidence":"SYNTHETIC:seed=20261029:shoe=14:round=2","card_count":4,"player_score":6,"banker_score":9},{"data_kind":"SYNTHETIC","shoe_id":"SYNTHETIC-00014","shoe_start":"2026-01-01T14:00:00+00:00","round_index":3,"outcome":"B","initial_counts_after_burn":[128,31,32,30,32,32,32,32,31,32],"remaining_counts_before":[126,30,31,29,30,31,31,32,31,31],"consumed_counts":[2,0,1,1,0,0,0,1,1,0],"composition_source":"synthetic_fully_observed_prefix","composition_through_round":2,"composition_evidence":"SYNTHETIC:seed=20261029:shoe=14:round=3","card_count":6,"player_score":3,"banker_score":7},{"data_kind":"SYNTHETIC","shoe_id":"SYNTHETIC-00014","shoe_start":"2026-01-01T14:00:00+00:00","round_index":4,"outcome":"P","initial_counts_after_burn":[128,31,32,30,32,32,32,32,31,32],"remaining_counts_before":[124,30,30,28,30,31,31,31,30,31],"consumed_counts":[3,0,0,0,0,0,0,2,1,0],"composition_source":"synthetic_fully_observed_prefix","composition_through_round":3,"composition_evidence":"SYNTHETIC:seed=20261029:shoe=14:round=4","card_count":6,"player_score":2,"banker_score":0},{"data_kind":"SYNTHETIC","shoe_id":"SYNTHETIC-00014","shoe_start":"2026-01-01T14:00:00+00:00","round_index":5,"outcome":"B","initial_counts_after_burn":[128,31,32,30,32,32,32,32,31,32],"remaining_counts_before":[121,30,30,28,30,31,31,29,29,31],"consumed_counts":[0,1,0,1,1,0,1,1,0,0],"composition_source":"synthetic_fully_observed_prefix","composition_through_round":4,"composition_evidence":"SYNTHETIC:seed=20261029:shoe=14:round=5","card_count":5,"player_score":4,"banker_score":7},{"data_kind":"SYNTHETIC","shoe_id":"SYNTHETIC-00014","shoe_start":"2026-01-01T14:00:00+00:00","round_index":6,"outcome":"B","initial_counts_after_burn":[128,31,32,30,32,32,32,32,31,32],"remaining_counts_before":[121,29,30,27,29,31,30,28,29,31],"consumed_counts":[1,2,0,0,0,1,1,0,0,0],"composition_source":"synthetic_fully_observed_prefix","composition_through_round":5,"composition_evidence":"SYNTHETIC:seed=20261029:shoe=14:round=6","card_count":5,"player_score":6,"banker_score":7},{"data_kind":"SYNTHETIC","shoe_id":"SYNTHETIC-00014","shoe_start":"2026-01-01T14:00:00+00:00","round_index":7,"outcome":"B","initial_counts_after_burn":[128,31,32,30,32,32,32,32,31,32],"remaining_counts_before":[120,27,30,27,29,30,29,28,29,31],"consumed_counts":[1,0,0,1,0,2,0,0,0,0],"composition_source":"synthetic_fully_observed_prefix","composition_through_round":6,"composition_evidence":"SYNTHETIC:seed=20261029:shoe=14:round=7","card_count":4,"player_score":5,"banker_score":8},{"data_kind":"SYNTHETIC","shoe_id":"SYNTHETIC-00014","shoe_start":"2026-01-01T14:00:00+00:00","round_index":8,"outcome":"B","initial_counts_after_burn":[128,31,32,30,32,32,32,32,31,32],"remaining_counts_before":[119,27,30,26,29,28,29,28,29,31],"consumed_counts":[3,0,0,0,2,0,0,0,0,1],"composition_source":"synthetic_fully_observed_prefix","composition_through_round":7,"composition_evidence":"SYNTHETIC:seed=20261029:shoe=14:round=8","card_count":6,"player_score":3,"banker_score":4},{"data_kind":"SYNTHETIC","shoe_id":"SYNTHETIC-00014","shoe_start":"2026-01-01T14:00:00+00:00","round_index":9,"outcome":"P","initial_counts_after_burn":[128,31,32,30,32,32,32,32,31,32],"remaining_counts_before":[116,27,30,26,27,28,29,28,29,30],"consumed_counts":[5,0,0,0,0,1,0,0,0,0],"composition_source":"synthetic_fully_observed_prefix","composition_through_round":8,"composition_evidence":"SYNTHETIC:seed=20261029:shoe=14:round=9","card_count":6,"player_score":5,"banker_score":0},{"data_kind":"SYNTHETIC","shoe_id":"SYNTHETIC-00014","shoe_start":"2026-01-01T14:00:00+00:00","round_index":10,"outcome":"P","initial_counts_after_burn":[128,31,32,30,32,32,32,32,31,32],"remaining_counts_before":[111,27,30,26,27,27,29,28,29,30],"consumed_counts":[2,0,2,1,0,0,0,0,1,0],"composition_source":"synthetic_fully_observed_prefix","composition_through_round":9,"composition_evidence":"SYNTHETIC:seed=20261029:shoe=14:round=10","card_count":6,"player_score":3,"banker_score":2},{"data_kind":"SYNTHETIC","shoe_id":"SYNTHETIC-00014","shoe_start":"2026-01-01T14:00:00+00:00","round_index":11,"outcome":"B","initial_counts_after_burn":[128,31,32,30,32,32,32,32,31,32],"remaining_counts_before":[109,27,28,25,27,27,29,28,28,30],"consumed_counts":[1,0,0,0,0,0,1,0,0,2],"composition_source":"synthetic_fully_observed_prefix","composition_through_round":10,"composition_evidence":"SYNTHETIC:seed=20261029:shoe=14:round=11","card_count":4,"player_score":6,"banker_score":8},{"data_kind":"SYNTHETIC","shoe_id":"SYNTHETIC-00014","shoe_start":"2026-01-01T14:00:00+00:00","round_index":12,"outcome":"P","initial_counts_after_burn":[128,31,32,30,32,32,32,32,31,32],"remaining_counts_before":[108,27,28,25,27,27,28,28,28,28],"consumed_counts":[2,0,0,0,0,2,1,0,0,0],"composition_source":"synthetic_fully_observed_prefix","composition_through_round":11,"composition_evidence":"SYNTHETIC:seed=20261029:shoe=14:round=12","card_count":5,"player_score":6,"banker_score":0},{"data_kind":"SYNTHETIC","shoe_id":"SYNTHETIC-00014","shoe_start":"2026-01-01T14:00:00+00:00","round_index":13,"outcome":"B","initial_counts_after_burn":[128,31,32,30,32,32,32,32,31,32],"remaining_counts_before":[106,27,28,25,27,25,27,28,28,28],"consumed_counts":[1,2,2,0,0,1,0,0,0,0],"composition_source":"synthetic_fully_observed_prefix","composition_through_round":12,"composition_evidence":"SYNTHETIC:seed=20261029:shoe=14:round=13","card_count":6,"player_score":5,"banker_score":6},{"data_kind":"SYNTHETIC","shoe_id":"SYNTHETIC-00014","shoe_start":"2026-01-01T14:00:00+00:00","round_index":14,"outcome":"B","initial_counts_after_burn":[128,31,32,30,32,32,32,32,31,32],"remaining_counts_before":[105,25,26,25,27,24,27,28,28,28],"consumed_counts":[1,0,1,0,0,1,1,0,0,0],"composition_source":"synthetic_fully_observed_prefix","composition_through_round":13,"composition_evidence":"SYNTHETIC:seed=20261029:shoe=14:round=14","card_count":4,"player_score":5,"banker_score":8},{"data_kind":"SYNTHETIC","shoe_id":"SYNTHETIC-00014","shoe_start":"2026-01-01T14:00:00+00:00","round_index":15,"outcome":"B","initial_counts_after_burn":[128,31,32,30,32,32,32,32,31,32],"remaining_counts_before":[104,25,25,25,27,23,26,28,28,28],"consumed_counts":[3,1,1,0,0,0,1,0,0,0],"composition_source":"synthetic_fully_observed_prefix","composition_through_round":14,"composition_evidence":"SYNTHETIC:seed=20261029:shoe=14:round=15","card_count":6,"player_score":2,"banker_score":7},{"data_kind":"SYNTHETIC","shoe_id":"SYNTHETIC-00014","shoe_start":"2026-01-01T14:00:00+00:00","round_index":16,"outcome":"B","initial_counts_after_burn":[128,31,32,30,32,32,32,32,31,32],"remaining_counts_before":[101,24,24,25,27,23,25,28,28,28],"consumed_counts":[1,0,1,0,0,0,0,0,1,1],"composition_source":"synthetic_fully_observed_prefix","composition_through_round":15,"composition_evidence":"SYNTHETIC:seed=20261029:shoe=14:round=16","card_count":4,"player_score":1,"banker_score":8},{"data_kind":"SYNTHETIC","shoe_id":"SYNTHETIC-00014","shoe_start":"2026-01-01T14:00:00+00:00","round_index":17,"outcome":"P","initial_counts_after_burn":[128,31,32,30,32,32,32,32,31,32],"remaining_counts_before":[100,24,23,25,27,23,25,28,27,27],"consumed_counts":[2,1,0,1,0,0,1,0,0,0],"composition_source":"synthetic_fully_observed_prefix","composition_through_round":16,"composition_evidence":"SYNTHETIC:seed=20261029:shoe=14:round=17","card_count":5,"player_score":7,"banker_score":3},{"data_kind":"SYNTHETIC","shoe_id":"SYNTHETIC-00014","shoe_start":"2026-01-01T14:00:00+00:00","round_index":18,"outcome":"B","initial_counts_after_burn":[128,31,32,30,32,32,32,32,31,32],"remaining_counts_before":[98,23,23,24,27,23,24,28,27,27],"consumed_counts":[2,0,0,0,0,1,0,0,0,1],"composition_source":"synthetic_fully_observed_prefix","composition_through_round":17,"composition_evidence":"SYNTHETIC:seed=20261029:shoe=14:round=18","card_count":4,"player_score":5,"banker_score":9},{"data_kind":"SYNTHETIC","shoe_id":"SYNTHETIC-00014","shoe_start":"2026-01-01T14:00:00+00:00","round_index":19,"outcome":"P","initial_counts_after_burn":[128,31,32,30,32,32,32,32,31,32],"remaining_counts_before":[96,23,23,24,27,22,24,28,27,26],"consumed_counts":[1,1,0,2,0,1,0,1,0,0],"composition_source":"synthetic_fully_observed_prefix","composition_through_round":18,"composition_evidence":"SYNTHETIC:seed=20261029:shoe=14:round=19","card_count":6,"player_score":9,"banker_score":0},{"data_kind":"SYNTHETIC","shoe_id":"SYNTHETIC-00014","shoe_start":"2026-01-01T14:00:00+00:00","round_index":20,"outcome":"P","initial_counts_after_burn":[128,31,32,30,32,32,32,32,31,32],"remaining_counts_before":[95,22,23,22,27,21,24,27,27,26],"consumed_counts":[0,1,1,0,1,1,0,1,1,0],"composition_source":"synthetic_fully_observed_prefix","composition_through_round":19,"composition_evidence":"SYNTHETIC:seed=20261029:shoe=14:round=20","card_count":6,"player_score":9,"banker_score":8},{"data_kind":"SYNTHETIC","shoe_id":"SYNTHETIC-00014","shoe_s